{"$defs":{"hash":{"pattern":"^[0-9a-f]{64}$","type":"string"},"nat":{"pattern":"^(0|[1-9][0-9]*)$","type":"string"},"pos":{"pattern":"^[1-9][0-9]*$","type":"string"},"root":{"additionalProperties":false,"properties":{"bits":{"const":"1"},"count":{"$ref":"#/$defs/nat"},"first":{"$ref":"#/$defs/nat"},"last":{"$ref":"#/$defs/nat"},"residue":{"const":"1"}},"required":["bits","count","first","last","residue"],"type":"object"}},"$id":"https://example.invalid/collatz/work-unit-v1.schema.json","$schema":"https://json-schema.org/draft/2020-12/schema","additionalProperties":false,"properties":{"config_id":{"$ref":"#/$defs/hash"},"index_range":{"additionalProperties":false,"properties":{"end":{"$ref":"#/$defs/nat"},"start":{"$ref":"#/$defs/nat"}},"required":["end","start"],"type":"object"},"k1":{"$ref":"#/$defs/pos"},"m":{"enum":["92","93","94","95","96"]},"root":{"$ref":"#/$defs/root"},"schema":{"const":"collatz.work-unit.v1"},"unit_id":{"$ref":"#/$defs/hash"}},"required":["config_id","index_range","k1","m","root","schema","unit_id"],"title":"Root-subinterval exhaustive-search work unit","type":"object"}
