{"config_id":"8860c544c8915438469a4eccdd607f7d32afe7d0403a1c7d6a7445159358cead","index_range":{"end":"64563604257983430655","start":"0"},"k1":"8","m":"93","root":{"bits":"1","count":"64563604257983430656","first":"9223372036854775809","last":"138350580552821637119","residue":"1"},"schema":"collatz.work-unit.v1","unit_id":"c3c0504a52e076ef946a9dc8d908a83201cf035a7e5d46376ef4587990f7c236"}
